"filename","title","description","feature","topic","audience","role","level"
"./help/build-and-manage-audiences/algorithmic-models/using-look-alike-models-to-extend-sold-out-inventory-from-your-1st-party-data.md","Using Look-Alike Models to Extend Sold Out Inventory from Your First Party Data","In this tutorial, we will walk through the steps you should take to set up and use Look-Alike Models, so that you can create new look-alike audiences, and sell them as an extension to your conversion segment.","algorithmic models","","all","",""
"./help/build-and-manage-audiences/profile-merge/profile-merge.md","Profile Merge Videos and Tutorials","This section contains videos and tutorials for Profile Merge features, like Profile Merge Rules.","profile merge","","all","",""
"./help/build-and-manage-audiences/profile-merge/overview-of-profile-merge-rules.md","Overview of Profile Merge Rules","Understand what Profile Merge Rules are, how they work, and their value to the Marketer.","profile merge","","all","",""
"./help/build-and-manage-audiences/profile-merge/profile-merge-rule-examples-and-use-cases.md","Profile Merge Rule Examples and Use Cases","In this video you will see examples of Profile Merge Rules and what they mean, as well as the use cases that Profile Merge Rules solve for.","profile merge","","all","",""
"./help/build-and-manage-audiences/profile-merge/choosing-the-right-profile-merge-rule.md","Choosing the Right Profile Merge Rule","In this video, discover three of the most common use cases for Profile Merge Rules, and how they can help your marketing efforts.","profile merge","","marketer","",""
"./help/build-and-manage-audiences/profile-merge/creating-and-using-simple-profile-merge-rules.md","Creating and Using Simple Profile Merge Rules","Learn about profile merge rules and how to assign them to segments. Learn about the default ""Current Device"" profile and when it can/should be used.","profile merge","","marketer","",""
"./help/build-and-manage-audiences/profile-merge/using-profile-merge-rules-to-personalize-in-an-authenticated-state.md","Using Profile Merge Rules to Personalize in an Authenticated State","Give your logged-in customers a personalized experience by using these Profile Merge Rule settings.","profile merge","","marketer","",""
"./help/build-and-manage-audiences/profile-merge/using-profile-merge-rules-for-device-extension-and-increased-reach.md","Using Profile Merge Rules for Device Extension and Increased Reach","Use Profile Merge Rules to extend reach to all of a user's devices, so that you can market to people instead of devices.","profile merge","","marketer","",""
"./help/build-and-manage-audiences/profile-merge/overview-of-profile-merge-rule-enhancements.md","Overview of Profile Merge Rule Enhancements","This video explains the enhancements to Profile Merge Rules, released in October 2019.","profile merge","","all","",""
"./help/build-and-manage-audiences/profile-merge/profile-merge-rule-enhancements-pre-requisites.md","Profile Merge Rule Enhancements - Pre-Requisites","An overview of how to best prepare for the release of Profile Merge Rule Enhancements.","profile merge","","all","",""
"./help/build-and-manage-audiences/profile-merge/how-profile-merge-rule-enhancements-impact-segmentation-activation-and-reporting.md","How Profile Merge Rule Enhancements Impact Segmentation, Activation, and Reporting","Understanding how Profile Merge Rule Enhancements will impact Total Trait and Segment Populations in the Audience Manager UI","profile merge","","all","",""
"./help/build-and-manage-audiences/profile-merge/interpret-audience-identity-reporting.md","Interpret Audience Identity Reporting","Audience Identity Reporting provides customers with the ability to report on the total population of a trait or segment by person/household definitions of identity. Watch this video to see how it is manifested in the Audience Manager reports.","profile merge","","all","",""
"./help/build-and-manage-audiences/profile-merge/understanding-cross-device-metrics-in-audience-manager.md","Understanding Cross-Device Metrics in Audience Manager","In this video we discuss the difference between device profiles and cross-device profiles, and show where the numbers in the UI match up with these different profile types.","profile merge","","administrator","",""
"./help/build-and-manage-audiences/profile-merge/customer-tips-getting-the-most-out-of-profile-merge-rules.md","Customer Tips - Getting the most out of Profile Merge Rules","Varun Kalra, Multi-Solution Consultant at Accordant, gives tips on choosing and using Profile Merge Rules (PMRs).","profile merge","","analyst","",""
"./help/data-activation/destinations-basics/understanding-audience-manager-destination-types.md","Understanding Audience Manager Destination Types","This video will walk you through the different types of destinations in Adobe Audience Manager, and give examples of when you would use each one.","destination basics","","all","",""
"./help/data-activation/destinations-basics/understanding-match-rates.md","Understanding Match Rates","This video helps you understand match rates in Adobe Audience Manager, what they are, and how they are calculated. You will also learn some best practices, as well as what can cause a low match rate.","match rates","","all","",""
"./help/data-activation/destinations-basics/understanding-the-match-rate-interface-in-audience-manager.md","Understanding the Match Rate Interface in Audience Manager","This video walks you through the destination interface, showing and explaining the numbers associated with match rates and addressable audiences.","match rates","","all","",""
"./help/data-activation/destinations-basics/using-data-export-labels-to-control-data-flow.md","Using Data Export Labels to Control Data Flow","Data Export Labels give you a mechanism in Audience Manager to control the flow of different data types/sources, so that you can meet your privacy requirements. Learn how and where to set Data Export Controls and Data Export Labels, to work in tandem to this end.","data export controls","","marketer","",""
"./help/data-activation/audience-lab/using-audience-lab-to-choose-a-dsp.md","Using Audience Lab to Choose a DSP","In this video we walk through creating an Audience Lab test, so that you can A/B test DSPs or other AAM destinations to see which one will drive the best return on ad spend.","audience lab","","all","",""
"./help/data-activation/people-based-destinations/pbd.md","People-Based Destinations Videos and Tutorials","This section contains videos and tutorials for topics regarding People-Based Destinations.","people-based destinations","","administrator","",""
"./help/data-activation/people-based-destinations/people-based-destinations-data-flow.md","People-Based Destinations Data Flow","This video gives an overview of People-Based Destinations and shows the data flow through the process.","people-based destinations","","all","",""
"./help/data-activation/people-based-destinations/creating-a-data-source-for-people-based-destinations.md","Creating a Data Source for People-Based Destinations","This video walks you through the creation of a Data Source in Audience Manager to be used for People-Based Destinations.","people-based destinations","","all","",""
"./help/data-activation/people-based-destinations/understanding-hashed-pii-data-ingestion-for-people-based-destinations.md","Understanding Hashed PII Data Ingestion for People-Based Destinations","This video will touch on the things you need to consider as you get ready to ingest PII into Audience Manager for People-Based Destinations.","people-based destinations","","all","",""
"./help/data-activation/people-based-destinations/ingesting-hashed-pii-for-people-based-destinations.md","Ingesting Hashed PII for People-Based Destinations","In this video, learn how to format a file-based ID sync, in order to hook together your customer IDs (CRM IDs) with hashed email addresses.","people-based destinations","","all","",""
"./help/data-activation/people-based-destinations/using-setcustomerids-to-ingest-and-hash-pii-as-a-declared-id.md","Using setCustomerIDs() to Ingest and Hash PII as a Declared ID","In this video, you will learn why and how to use the Experience Cloud ID Service's setCustomerIDs() method to ingest and hash an email address, and to use it as a declared ID. This will not only tie together the CRM ID and the email address, but also sync them to the Adobe Audience Manager UUID, i.e. the anonymous device ID. These hashed email addresses can then be sent to People-Based Destinations.","people-based destinations","","implementer, developer","",""
"./help/data-activation/people-based-destinations/configuring-profile-merge-rules-for-people-based-destinations.md","Configuring Profile Merge Rules for People-Based Destinations","In this video, learn about how to set up a Profile Merge Rule to be used for People-Based Destinations, including when to use a brand new cross-device option.","people-based destinations","","all","",""
"./help/data-activation/people-based-destinations/creating-segments-for-people-based-destinations.md","Creating Segments for People-Based Destinations in Adobe Audience Manager","This video walks you through the creation of a segment in Audience Manager to be used for People-Based Destinations.","people-based destinations","","all","",""
"./help/data-activation/people-based-destinations/create-and-configure-people-based-destinations.md","Create and Configure People-based Destinations","This video first gives you some information about prerequisites to creating your People-Based Destination, and then also shows you how to configure an Integrated Account (link to the partner, E.g. Facebook). It then walks you through the in-product setup of the destination itself.","people-based destinations","","all","",""
"./help/data-activation/people-based-destinations/understanding-and-configuring-the-linkedin-pbd.md","Understanding and Configuring the LinkedIn People-Based Destination","This video walks you through the concepts and steps to create a People-Based Destination to LinkedIn. It builds on the additional videos and documentation regarding People-Based Destinations.","people-based destinations","","administrator","",""
"./help/data-activation/people-based-destinations/understanding-and-configuring-the-google-customer-match-pbd.md","Understanding and Configuring the Google Customer Match People-Based Destination","This video walks you through the details and use case of the Google Customer Match People Based Destination, and includes a walkthrough of creating a segment and mapping it to a destination. It also shows the audience landing in the Google Ad Console.","people-based destinations","","marketer","",""
"./help/reports/using-general-reports-with-traits-and-segments.md","Using General Reports with Traits and Segments","In this video, see how to use the general reports in Audience Manager to get numbers for traits and segments.","general & trend reports","","marketer","",""
"./help/reports/using-trended-reports-with-traits-and-segments.md","Using Trended Reports with Traits and Segments","Learn how to use the trended reports in Audience Manager to see how traits and segments are performing over time.","general & trend reports","","marketer","",""
"./help/reports/understand-related-audiences-with-overlap-reports.md","Understand Related Audiences with Overlap Reports","Overlap reports allow you to see how trait and segment audiences overlap with each other (same visitor in multiple traits or segments), so that you know where you can act with your data to increase conversion or focus on expanding reach.","overlap reports","","marketer","",""
"./help/reports/using-audience-optimization-reports-to-understand-media-performance.md","Using Audience Optimization Reports to Understand Media Performance","Learn how to use the Audience Optimization Reports to improve your campaigns, understanding where to invest your marketing dollars and where to stop investing. Also learn how to determine optimal frequency capping and find other gems in these reports.","audience optimization reports","","marketer","",""
"./help/other-integrations/integrating-with-rtcdp/rtcdp-1pd-ingestion-for-aam-users.md","Understanding 1st Party Data Ingestion in Real-time CDP for Audience Manager Users","This video discusses 1st-party offline data ingestion into Real-time Customer Data Platform (Real-time CDP) for those who have been using Adobe Audience Manager. We look at some of the main differences between the two products regarding data ingestion and shows how the Audience Manager Data Connector can be used as a stop gap until processes have been moved over to Real-time CDP.","Platform Integration","","marketer","",""
"./help/other-integrations/integrating-with-rtcdp/rtcdp-web-ingestion-for-aam-users.md","Understanding Web Data Ingestion in Real-time CDP for Audience Manager Users","This video shows Audience Manager users the concepts regarding bringing Web site data into Real-time Customer Data Platform (Real-time CDP), and includes a high-level touch on where the Audience Manager Data Connector fits, as well as how the data can move from the Web site directly through the Web SDK into Real-time CDP.","Platform Integration","","marketer","",""
"./help/other-integrations/integrating-with-rtcdp/rtcdp-traits-for-aam-users.md","Understanding Traits in Real-time CDP for Audience Manager Users","As you move from Audience Manager to Real-time Customer Data Platform, it is helpful to understand the differences in concepts. This video addresses traits in Audience Manager and what the equivalent is in Real-time CDP.","Platform Integration","","marketer","",""
"./help/other-integrations/integrating-with-rtcdp/rtcdp-segments-for-aam-users.md","Understanding Segments in Real-time CDP for Audience Manager Users","As you move from Audience Manager to Real-time Customer Data Platform, it is helpful to understand the differences in concepts. This video looks at the differences in segments and segment creation between Audience Manager and Real-time CDP.","Platform Integration","","marketer","",""
"./help/other-integrations/integrating-with-ad-cloud/advertising-cloud-and-audience-manager-integration.md","Adobe Advertising Cloud and Adobe Audience Manager Integration","Learn how the integration between Adobe Audience Manager and Adobe Ad Cloud works. Also get answers about match rates and third party cookie-synching.","integrating with ad cloud","","all","",""
"./help/api/retrieve-api-credentials-in-adobe-io.md","Retrieve API Credentials in Adobe IO","Instead of contacting Adobe Consulting or Customer Care for credentials for using the REST API, you can simply go to Adobe.io in a browser and retrieve or register your own credentials.","api","","developer","",""
